Entry ID;Jurisdiction;Intervention category;Intervention type;Description;Organization;Start date
ON253;Ontario;Distancing;Gatherings;Indoor gatherings limited to 10 and outdoor gatherings to 25 people in the regions of Toronto, Peel and Ottawa;Ministry of Health;September 18, 2020
ON254;Ontario;Distancing;Gatherings;Indoor gatherings limited to 10 and outdoor gatherings to 25 people across all regions in the province;Office of the Premier;September 19, 2020
ON260;Ontario;Closures/openings;Non-essential services;Restaurants/bars for all regions in Stage 3 restricted to serving alcohol to 11 p.m. and must close by midnight (except takeout/delivery);Ministry of Health;September 26, 2020
ON261;Ontario;Closures/openings;Non-essential services;All strip clubs closed;Ministry of Health;September 26, 2020
ON267;Ontario;Health workforce;Licence reinstatement/reclassification;Modification to temporary registration criteria for chiropractors announced;College of Chiropractors of Ontario;August 12, 2020
ON268;Ontario;Health workforce;Safety guidelines;Guidance published for dentists on safety precautions when performing aerosol-generating procedures;Royal College of Dental Surgeons of Ontario;September 11, 2020
ON269;Ontario;Health workforce;Safety guidelines;Guidance on screening, testing and occupational safety for home and community care providers published;Ministry of Health;September 17, 2020
ON270;Ontario;Health workforce;Change in practice;Guidance for safe COVID-19 testing for pharmacists published;Government of Ontario, Office of the Premier;September 25, 2020